name,website,industry,company_size,headquarters,founded,specialties
Cambrian Intelligence SL,http://cambrianintelligence.com/,Information Technology & Services,2-10 employees,"Madrid, Madrid",,
Applus+ Laboratories,https://www.appluslaboratories.com/,Business Consulting and Services,"1,001-5,000 employees","Bellaterra, BARCELONA",,"Fire Safety & Thermo technics testing, Cybersecurity evaluations, EMC, Wireless & Electrical safety testing, Environmental, Vibrations & Acoustics testing, Calibration & Metrology, Test Systems & Tooling development, Engineering Services, Fine Chemistry Pilot Plant, Medical Devices, Drones, Global Market access, Non-Destructive Testing, and Neutron Radiography"
Robotnik Automation,http://www.robotnik.eu,Robotics Engineering,51-200 employees,"Valencia, Paterna-Valencia",2002,"robotics, Automation, Mobile Manipulation, Mobile Robotics, AMR, and Robótica Móvil"
PIMEC,http://www.pimec.org,Civic and Social Organizations,51-200 employees,,1997,"internacionalización, asesoramiento, pimes, autónomos, medio ambiente, nuevas tecnologías, comunicación, institucional, leyes, relaciones laborales, finanzas, financiación, recursos humanos, and formación"
ETS Asset Management Factory,http://www.etsfactory.com,Investment Management,51-200 employees,"Pozuelo de Alarcón, Madrid",1987,
Ibertech IT Services,http://www.ibertech.org,IT Services and IT Consulting,51-200 employees,"Madrid, Madrid",2002,"Servicios Profesionales, Planes de Formación Profesionales TIC, Outsourcing, Headhunting TIC, and KONOSYS (Unidad de Negocio Servicios de Valor OpenSource)"
